[
  {
    "id": "id-finance-share-access",
    "version": 1,
    "title": "Can't open the Finance share",
    "client": "salone-mutual",
    "category": "identity",
    "tags": [
      "interview",
      "security-plus",
      "it-support",
      "release-1"
    ],
    "difficulty": 2,
    "estimated_minutes": 15,
    "sla": {
      "priority": "P3",
      "resolve_within": "4h"
    },
    "notification": {
      "kind": "break_fix",
      "channel": "chat",
      "persona": "ibrahim-finance",
      "title": "Access denied on \\\\FS01\\Finance",
      "opening": "Hello, since this morning I get 'Access is denied' when I open the Finance folder. I need the month-end reports!"
    },
    "persona": {
      "name": "Ibrahim Conteh",
      "role": "Senior Accountant",
      "traits": [
        "stressed",
        "cooperative"
      ]
    },
    "affected_nodes": [
      "DC01",
      "FS01",
      "WS-FIN-02"
    ],
    "setup": [
      {
        "target": "DC01",
        "run": "scripts/inject.ps1"
      }
    ],
    "cleanup": [
      {
        "target": "DC01",
        "run": "scripts/restore.ps1"
      }
    ],
    "client_facts": [
      {
        "ask": [
          "did anything change",
          "changed",
          "moved",
          "new role"
        ],
        "answer": "Nothing... oh, HR updated my title last week after my promotion."
      },
      {
        "ask": [
          "whoami",
          "groups",
          "whoami /groups"
        ],
        "tool": "read.whoami_groups",
        "target": "WS-FIN-02"
      },
      {
        "ask": [
          "error",
          "message",
          "screenshot"
        ],
        "answer": "It says: Windows cannot access \\\\FS01\\Finance. You do not have permission."
      }
    ],
    "hints": [
      "Compare the user's group memberships to the share's permissions.",
      "Check Get-ADUser iconteh -Properties MemberOf.",
      "He was moved from GG-Finance to GG-Operations. Add him back to GG-Finance."
    ],
    "checks": [
      {
        "id": "in-finance-group",
        "label": "iconteh is a member of GG-Finance",
        "target": "DC01",
        "run": "scripts/check_group.ps1"
      },
      {
        "id": "share-access",
        "label": "iconteh can read \\\\FS01\\Finance",
        "target": "FS01",
        "run": "scripts/check_access.ps1"
      }
    ],
    "debrief": {
      "interviewer": "hiring-manager",
      "root_cause": "A mover change put the user in GG-Operations and removed GG-Finance, so the NTFS ACL denied access.",
      "must_cover": [
        "group membership",
        "ntfs",
        "agdlp",
        "mover",
        "kerberos ticket"
      ],
      "what_ifs": [
        "You add him back but he still gets access denied. Why might that be?",
        "How do you stop mover changes from silently removing access people still need?"
      ],
      "prevention": "Role-based groups owned by HR data, plus an access review after each mover event.",
      "rubric": {
        "root_cause": 30,
        "safe_fix": 25,
        "verification": 20,
        "documentation": 15,
        "client_explanation": 10
      }
    }
  },
  {
    "id": "id-lockout-stale-device",
    "version": 1,
    "title": "Locked out every 10 minutes",
    "client": "salone-mutual",
    "category": "identity",
    "tags": [
      "interview",
      "it-support",
      "security-plus",
      "release-1"
    ],
    "difficulty": 3,
    "estimated_minutes": 25,
    "sla": {
      "priority": "P2",
      "resolve_within": "4h"
    },
    "notification": {
      "kind": "break_fix",
      "channel": "chat",
      "persona": "john-ops",
      "title": "Account keeps locking",
      "opening": "IT, my account keeps locking! I changed my password yesterday like the email said, and now I'm locked out every few minutes. This is the third time today."
    },
    "persona": {
      "name": "John Davies",
      "role": "Logistics Supervisor",
      "traits": [
        "impatient",
        "frustrated"
      ]
    },
    "affected_nodes": [
      "DC01"
    ],
    "setup": [
      {
        "target": "DC01",
        "run": "scripts/inject.ps1"
      }
    ],
    "cleanup": [
      {
        "target": "DC01",
        "run": "scripts/restore.ps1"
      }
    ],
    "client_facts": [
      {
        "ask": [
          "phone",
          "mobile",
          "email on phone",
          "other devices"
        ],
        "answer": "I have work email on my phone, yes. Why?"
      },
      {
        "ask": [
          "when did you change",
          "password change"
        ],
        "answer": "Yesterday afternoon, from my desktop."
      }
    ],
    "hints": [
      "Lockouts are caused by bad passwords somewhere. Find where they come from.",
      "Event 4740 on the PDC emulator records the source of each lockout.",
      "The source is MBL-JDAVIES, his phone, still using the old password. Unlock the account and have him update the phone."
    ],
    "checks": [
      {
        "id": "unlocked",
        "label": "jdavies is not locked out",
        "target": "DC01",
        "run": "scripts/check_unlocked.ps1"
      },
      {
        "id": "source-fixed",
        "label": "No bad-password attempts from MBL-JDAVIES for 5 minutes",
        "target": "DC01",
        "run": "scripts/check_source.ps1"
      }
    ],
    "debrief": {
      "interviewer": "hiring-manager",
      "root_cause": "A mobile device kept retrying the old password after a change, tripping the lockout threshold.",
      "must_cover": [
        "event 4740",
        "lockout source",
        "pdc emulator",
        "stale credentials",
        "user communication"
      ],
      "what_ifs": [
        "Event 4740 shows the caller as the Exchange server, not a device. Now what?",
        "Same pattern for 40 users at once. What does that suggest?"
      ],
      "prevention": "Modern auth on mobile mail, plus user guidance sent with every password-change reminder.",
      "rubric": {
        "root_cause": 30,
        "safe_fix": 20,
        "verification": 20,
        "documentation": 10,
        "client_explanation": 20
      }
    }
  },
  {
    "id": "net-access-port-vlan",
    "version": 1,
    "title": "PC has no network",
    "client": "salone-mutual",
    "category": "network",
    "tags": [
      "ccna",
      "interview",
      "release-1"
    ],
    "difficulty": 1,
    "estimated_minutes": 15,
    "sla": {
      "priority": "P3",
      "resolve_within": "4h"
    },
    "notification": {
      "kind": "break_fix",
      "channel": "chat",
      "persona": "mariama-ops",
      "title": "No network on WS-OPS-03",
      "opening": "Hi, my computer says 'No internet' and I can't get on anything. The cable is plugged in, I checked."
    },
    "persona": {
      "name": "Mariama Kanu",
      "role": "Operations Coordinator",
      "traits": [
        "polite",
        "non-technical"
      ]
    },
    "affected_nodes": [
      "SW-ACC-01",
      "WS-OPS-03"
    ],
    "setup": [
      {
        "target": "SW-ACC-01",
        "run": "scripts/inject.ios"
      }
    ],
    "cleanup": [
      {
        "target": "SW-ACC-01",
        "run": "scripts/restore.ios"
      }
    ],
    "client_facts": [
      {
        "ask": [
          "ipconfig",
          "ip address",
          "what ip"
        ],
        "tool": "read.ipconfig",
        "target": "WS-OPS-03"
      },
      {
        "ask": [
          "lights",
          "link light",
          "cable"
        ],
        "answer": "There's a green light on the back where the cable goes in."
      },
      {
        "ask": [
          "which port",
          "wall port",
          "port number"
        ],
        "answer": "The sticker on the wall says Port 12."
      }
    ],
    "hints": [
      "A 169.254.x.x address means the PC never heard back from DHCP.",
      "Check what VLAN the switch port is in: show interfaces status.",
      "Gi0/12 is in VLAN 99 (unused). Put it back in access VLAN 20."
    ],
    "checks": [
      {
        "id": "port-vlan",
        "label": "Gi0/12 is an access port in VLAN 20",
        "target": "SW-ACC-01",
        "run": "scripts/check_vlan.ios"
      },
      {
        "id": "client-dhcp",
        "label": "WS-OPS-03 has a 10.10.20.x lease",
        "target": "WS-OPS-03",
        "run": "scripts/check_lease.ps1"
      }
    ],
    "debrief": {
      "interviewer": "senior-network-engineer",
      "root_cause": "Access port Gi0/12 was assigned to VLAN 99, which has no DHCP scope or gateway, so the PC self-assigned APIPA.",
      "must_cover": [
        "vlan",
        "access port",
        "dhcp",
        "apipa",
        "show interfaces status"
      ],
      "what_ifs": [
        "The port is in VLAN 20 but the PC still gets 169.254. What next?",
        "How do you prevent one wrong VLAN change on 500 switch ports?"
      ],
      "prevention": "Port configs from templates in NetBox, pushed by automation, with drift detection.",
      "rubric": {
        "root_cause": 30,
        "safe_fix": 25,
        "verification": 20,
        "documentation": 15,
        "client_explanation": 10
      }
    }
  },
  {
    "id": "net-dhcp-dns-option",
    "version": 1,
    "title": "Can't reach anything by name",
    "client": "salone-mutual",
    "category": "network",
    "tags": [
      "ccna",
      "interview",
      "release-1"
    ],
    "difficulty": 2,
    "estimated_minutes": 20,
    "sla": {
      "priority": "P2",
      "resolve_within": "2h"
    },
    "notification": {
      "kind": "break_fix",
      "channel": "chat",
      "persona": "ibrahim-finance",
      "title": "Websites and SalonePay won't load",
      "opening": "Nothing loads! Chrome says 'site can't be reached' for SalonePay and even Google. But Teams calls still work?"
    },
    "persona": {
      "name": "Ibrahim Conteh",
      "role": "Senior Accountant",
      "traits": [
        "stressed",
        "cooperative"
      ]
    },